CREATE EXTENSION yezzey;
SET client_min_messages TO WARNING;
-- AO
CREATE TABLE simple_regaoty(i INT) WITH (appendonly=true);
INSERT INTO simple_regaoty SELECT * FROM generate_series(1, 100000);
SELECT * FROM yezzey_define_offload_policy('simple_regaoty');
                            status                            
--------------------------------------------------------------
 offloaded relation public.simple_regaoty to external storage
(1 row)

SELECT reltablespace FROM pg_class where oid = 'simple_regaoty'::regclass::oid;
 reltablespace 
---------------
          8555
(1 row)

SELECT count(1) FROM gp_dist_random('yezzey.yezzey_virtual_index') WHERE relation = 'simple_regaoty'::regclass;
 count 
-------
     3
(1 row)

INSERT INTO simple_regaoty SELECT * FROM generate_series(1, 100000);
SELECT count(1) FROM simple_regaoty;
 count  
--------
 200000
(1 row)

UPDATE simple_regaoty SET i = i + 1;
SELECT count(1) FROM simple_regaoty;
 count  
--------
 200000
(1 row)

DELETE FROM simple_regaoty WHERE i < 50501;
SELECT count(1) FROM simple_regaoty;
 count 
-------
 99002
(1 row)

SELECT * FROM simple_regaoty ORDER BY i LIMIT 5 OFFSET 7823;
   i   
-------
 54412
 54413
 54413
 54414
 54414
(5 rows)

SELECT segindex,external_bytes FROM yezzey_offload_relation_status('simple_regaoty');
 segindex | external_bytes 
----------+----------------
        0 |        1340656
        1 |        1335208
        2 |        1330592
(3 rows)

SELECT segindex,segfileindex,external_bytes FROM yezzey_offload_relation_status_per_filesegment('simple_regaoty');
 segindex | segfileindex | external_bytes 
----------+--------------+----------------
        0 |            1 |        1340656
        1 |            1 |        1335208
        2 |            1 |        1330592
(3 rows)

SELECT segindex,segfileindex,external_bytes FROM yezzey_relation_describe_external_storage_structure('simple_regaoty');
 segindex | segfileindex | external_bytes 
----------+--------------+----------------
        0 |            1 |         335168
        0 |            1 |         335168
        0 |            1 |         670320
        1 |            1 |         333816
        1 |            1 |         333816
        1 |            1 |         667576
        2 |            1 |         332656
        2 |            1 |         332656
        2 |            1 |         665280
(9 rows)

SELECT count(), sum(external_bytes) FROM yezzey_offload_relation_status('simple_regaoty');
 count |   sum   
-------+---------
     3 | 4006456
(1 row)

SELECT count(), sum(external_bytes) FROM yezzey_offload_relation_status_per_filesegment('simple_regaoty');
 count |   sum   
-------+---------
     3 | 4006456
(1 row)

SELECT count(), sum(external_bytes) FROM yezzey_relation_describe_external_storage_structure('simple_regaoty');
 count |   sum   
-------+---------
     9 | 4006456
(1 row)

DROP TABLE simple_regaoty;
DROP EXTENSION yezzey;
CHECKPOINT;
