CREATE EXTENSION yezzey VERSION '1.0';
-- check that load result of is correct
ALTER EXTENSION yezzey UPDATE TO '1.8.6';
SET client_min_messages TO WARNING;
-- AO
\! rm -fr /tmp/test_spc_tab1 && mkdir -p /tmp/test_spc_tab1
\! rm -fr /tmp/test_spc_tab2 && mkdir -p /tmp/test_spc_tab2
CREATE TABLESPACE tab1 LOCATION '/tmp/test_spc_tab1';
CREATE TABLESPACE tab2 LOCATION '/tmp/test_spc_tab2';
-- Create tables
CREATE TABLE yezzey_otm_regaoty_1(i INT, s TEXT) WITH (appendonly=true) TABLESPACE tab1;
INSERT INTO yezzey_otm_regaoty_1 SELECT i, 'sdsd' FROM generate_series(1, 100000) i;
ALTER TABLE yezzey_otm_regaoty_1 ALTER COLUMN s SET STORAGE EXTERNAL;
INSERT INTO yezzey_otm_regaoty_1 VALUES (1111, repeat('a', 2323323));
CREATE TABLE yezzey_otm_regaoty_2(i INT, s TEXT) WITH (appendonly=true) TABLESPACE tab2;
INSERT INTO yezzey_otm_regaoty_2 SELECT i, 'dssd' FROM generate_series(1, 100000) i;
ALTER TABLE yezzey_otm_regaoty_2 ALTER COLUMN s SET STORAGE EXTERNAL;
INSERT INTO yezzey_otm_regaoty_2 VALUES (1111, repeat('a', 2323323));
SELECT * FROM yezzey_define_offload_policy('yezzey_otm_regaoty_1');
 yezzey_define_offload_policy 
------------------------------
 
(1 row)

SELECT reltablespace FROM pg_class where oid = 'yezzey_otm_regaoty_1'::regclass::oid;
 reltablespace 
---------------
          8555
(1 row)

INSERT INTO yezzey_otm_regaoty_1 SELECT * FROM generate_series(1, 100000);
UPDATE yezzey_otm_regaoty_1 SET i = i + 1;
DELETE FROM yezzey_otm_regaoty_1 WHERE i < 50501;
SELECT count(x_path) FROM yezzey_dump_virtual_index('yezzey_otm_regaoty_1');
 count 
-------
     9
(1 row)

VACUUM FULL yezzey_otm_regaoty_1;
SELECT count(x_path) FROM yezzey_dump_virtual_index('yezzey_otm_regaoty_1');
 count 
-------
     3
(1 row)

SELECT yezzey_vacuum_garbage_relation('yezzey_otm_regaoty_1', true, true);
 yezzey_vacuum_garbage_relation 
--------------------------------
 
(1 row)

SELECT * FROM yezzey_relation_describe_external_storage_structure('yezzey_otm_regaoty_1');
 offload_reloid | segindex | segfileindex | external_storage_filepath | local_bytes | local_commited_bytes | external_bytes 
----------------+----------+--------------+---------------------------+-------------+----------------------+----------------
(0 rows)

SELECT * FROM yezzey_define_offload_policy('yezzey_otm_regaoty_2');
 yezzey_define_offload_policy 
------------------------------
 
(1 row)

SELECT reltablespace FROM pg_class where oid = 'yezzey_otm_regaoty_2'::regclass::oid;
 reltablespace 
---------------
          8555
(1 row)

INSERT INTO yezzey_otm_regaoty_2 SELECT * FROM generate_series(1, 100000);
UPDATE yezzey_otm_regaoty_2 SET i = i + 1;
DELETE FROM yezzey_otm_regaoty_2 WHERE i < 50501;
SELECT count(x_path) FROM yezzey_dump_virtual_index('yezzey_otm_regaoty_1');
 count 
-------
     3
(1 row)

VACUUM FULL yezzey_otm_regaoty_2;
SELECT count(x_path) FROM yezzey_dump_virtual_index('yezzey_otm_regaoty_1');
 count 
-------
     3
(1 row)

SELECT yezzey_vacuum_garbage_relation('yezzey_otm_regaoty_2', true, true);
 yezzey_vacuum_garbage_relation 
--------------------------------
 
(1 row)

SELECT * FROM yezzey_relation_describe_external_storage_structure('yezzey_otm_regaoty_2');
 offload_reloid | segindex | segfileindex | external_storage_filepath | local_bytes | local_commited_bytes | external_bytes 
----------------+----------+--------------+---------------------------+-------------+----------------------+----------------
(0 rows)

SELECT yezzey_load_relation('yezzey_otm_regaoty_1');
INFO:  loaded relation yezzey_otm_regaoty_1s to local storage
CONTEXT:  SQL statement "SELECT yezzey_load_relation(
        'public',
        load_relname
    )"
PL/pgSQL function yezzey_load_relation(text) line 5 at PERFORM
 yezzey_load_relation 
----------------------
 
(1 row)

SELECT spcname from pg_tablespace where oid = (select reltablespace from pg_class where relname='yezzey_otm_regaoty_1');
 spcname 
---------
 tab1
(1 row)

SELECT yezzey_load_relation('yezzey_otm_regaoty_2');
INFO:  loaded relation yezzey_otm_regaoty_2s to local storage
CONTEXT:  SQL statement "SELECT yezzey_load_relation(
        'public',
        load_relname
    )"
PL/pgSQL function yezzey_load_relation(text) line 5 at PERFORM
 yezzey_load_relation 
----------------------
 
(1 row)

SELECT spcname from pg_tablespace where oid = (select reltablespace from pg_class where relname='yezzey_otm_regaoty_2');
 spcname 
---------
 tab2
(1 row)

-- test simple reorgnaze & vacuum 
ALTER TABLE yezzey_otm_regaoty_1 SET WITH (reorganize=TRUE);
VACUUM FULL yezzey_otm_regaoty_1;
ALTER TABLE yezzey_otm_regaoty_2 SET WITH (reorganize=TRUE);
VACUUM FULL yezzey_otm_regaoty_2;
DROP TABLE yezzey_otm_regaoty_1;
DROP TABLE yezzey_otm_regaoty_2;
DROP TABLESPACE tab1;
DROP TABLESPACE tab2;
DROP EXTENSION yezzey;
CHECKPOINT;
