CREATE EXTENSION yezzey;
SET client_min_messages TO WARNING;
-- AO
CREATE TABLE regaostat(i INT) WITH (appendonly=true);
INSERT INTO regaostat SELECT * FROM generate_series(1, 100000);
SELECT sum(local_bytes), sum(external_bytes) FROM yezzey_offload_relation_status('regaostat');
   sum   | sum 
---------+-----
 1001640 |   0
(1 row)

SELECT * FROM yezzey_define_offload_policy('regaostat');
 yezzey_define_offload_policy 
------------------------------
 
(1 row)

SELECT sum(local_bytes), sum(external_bytes) FROM yezzey_offload_relation_status('regaostat');
 sum |   sum   
-----+---------
   0 | 1001640
(1 row)

SELECT reltablespace FROM pg_class where oid = 'regaostat'::regclass::oid;
 reltablespace 
---------------
          8555
(1 row)

SELECT sum(local_bytes), sum(external_bytes) FROM yezzey_offload_relation_status('regaostat');
 sum |   sum   
-----+---------
   0 | 1001640
(1 row)

DELETE FROM regaostat;
INSERT INTO regaostat SELECT * FROM generate_series(1, 100000);
SELECT sum(local_bytes), sum(external_bytes) FROM yezzey_offload_relation_status('regaostat');
 sum |   sum   
-----+---------
   0 | 2003280
(1 row)

VACUUM regaostat;
SELECT sum(local_bytes), sum(external_bytes) FROM yezzey_offload_relation_status('regaostat');
 sum |   sum   
-----+---------
   0 | 3004920
(1 row)

SELECT yezzey_load_relation('regaostat');
INFO:  loaded relation regaostats to local storage
CONTEXT:  SQL statement "SELECT yezzey_load_relation(
        'public',
        load_relname
    )"
PL/pgSQL function yezzey_load_relation(text) line 5 at PERFORM
 yezzey_load_relation 
----------------------
 
(1 row)

SELECT sum(local_bytes), sum(external_bytes) FROM yezzey_offload_relation_status('regaostat');
   sum   |   sum   
---------+---------
 1001640 | 3004920
(1 row)

SELECT sum(local_bytes), sum(external_bytes), sum(external_bloat_bytes) FROM yezzey_offload_relation_status('regaostat');
   sum   |   sum   |   sum   
---------+---------+---------
 1001640 | 3004920 | 3004920
(1 row)

SELECT * FROM yezzey_define_offload_policy('regaostat');
 yezzey_define_offload_policy 
------------------------------
 
(1 row)

SELECT sum(local_bytes), sum(external_bytes), sum(external_bloat_bytes) FROM yezzey_offload_relation_status('regaostat');
 sum |   sum   |   sum   
-----+---------+---------
   0 | 4006560 | 3004920
(1 row)

VACUUM (YEZZEY);
SELECT sum(local_bytes), sum(external_bytes), sum(external_bloat_bytes) FROM yezzey_offload_relation_status('regaostat');
 sum |   sum   | sum 
-----+---------+-----
   0 | 1001640 |   0
(1 row)

DROP TABLE regaostat;
-- AOCS
CREATE TABLE regaocsstat(i INT, j INT, k INT, r INT) WITH (appendonly=true, orientation=column);
INSERT INTO regaocsstat SELECT i,i,i,i FROM generate_series(1, 100000) i;
-- TODO: fix
-- SELECT sum(local_bytes), sum(external_bytes) FROM yezzey_offload_relation_status('regaocsstat');
SELECT * FROM yezzey_define_offload_policy('regaocsstat');
 yezzey_define_offload_policy 
------------------------------
 
(1 row)

SELECT sum(local_bytes), sum(external_bytes) FROM yezzey_offload_relation_status('regaocsstat');
 sum |   sum   
-----+---------
   0 | 1602624
(1 row)

SELECT reltablespace FROM pg_class where oid = 'regaocsstat'::regclass::oid;
 reltablespace 
---------------
          8555
(1 row)

SELECT sum(local_bytes), sum(external_bytes) FROM yezzey_offload_relation_status('regaocsstat');
 sum |   sum   
-----+---------
   0 | 1602624
(1 row)

DELETE FROM regaocsstat;
INSERT INTO regaocsstat SELECT i,i,i,i FROM generate_series(1, 100000)i;
SELECT sum(local_bytes), sum(external_bytes) FROM yezzey_offload_relation_status('regaocsstat');
 sum |   sum   
-----+---------
   0 | 3205248
(1 row)

VACUUM regaocsstat;
SELECT sum(local_bytes), sum(external_bytes) FROM yezzey_offload_relation_status('regaocsstat');
 sum |   sum   
-----+---------
   0 | 4807872
(1 row)

SELECT yezzey_load_relation('regaocsstat');
INFO:  loaded relation regaocsstats to local storage
CONTEXT:  SQL statement "SELECT yezzey_load_relation(
        'public',
        load_relname
    )"
PL/pgSQL function yezzey_load_relation(text) line 5 at PERFORM
 yezzey_load_relation 
----------------------
 
(1 row)

SELECT sum(local_bytes), sum(external_bytes) FROM yezzey_offload_relation_status('regaocsstat');
   sum   |   sum   
---------+---------
 1602624 | 4807872
(1 row)

SELECT sum(local_bytes), sum(external_bytes), sum(external_bloat_bytes) FROM yezzey_offload_relation_status('regaocsstat');
   sum   |   sum   |   sum   
---------+---------+---------
 1602624 | 4807872 | 4807872
(1 row)

SELECT * FROM yezzey_define_offload_policy('regaocsstat');
 yezzey_define_offload_policy 
------------------------------
 
(1 row)

SELECT sum(local_bytes), sum(external_bytes), sum(external_bloat_bytes) FROM yezzey_offload_relation_status('regaocsstat');
 sum |   sum   |   sum   
-----+---------+---------
   0 | 6410496 | 4807872
(1 row)

VACUUM (YEZZEY);
SELECT sum(local_bytes), sum(external_bytes), sum(external_bloat_bytes) FROM yezzey_offload_relation_status('regaocsstat');
 sum |   sum   | sum 
-----+---------+-----
   0 | 1602624 |   0
(1 row)

DROP TABLE regaocsstat;
DROP EXTENSION yezzey;
CHECKPOINT;
