CREATE EXTENSION yezzey;
ALTER EXTENSION yezzey UPDATE TO '1.8';
SET client_min_messages TO WARNING;
-- AO
\! mkdir -p /tmp/test_spc_tab1
CREATE TABLESPACE tab1 LOCATION '/tmp/test_spc_tab1';
\! mkdir -p /tmp/test_spc_tab2
CREATE TABLESPACE tab2 LOCATION '/tmp/test_spc_tab2';
CREATE TABLE yezzey_otm_regaoty_1(i INT) WITH (appendonly=true) TABLESPACE tab1;
INSERT INTO yezzey_otm_regaoty_1 SELECT * FROM generate_series(1, 100000);
CREATE TABLE yezzey_otm_regaoty_2(i INT) WITH (appendonly=true) TABLESPACE tab2;
INSERT INTO yezzey_otm_regaoty_2 SELECT * FROM generate_series(1, 100000);
SELECT * FROM yezzey_define_offload_policy('yezzey_otm_regaoty_1');
 yezzey_define_offload_policy 
------------------------------
 
(1 row)

SELECT reltablespace FROM pg_class where oid = 'yezzey_otm_regaoty_1'::regclass::oid;
 reltablespace 
---------------
          8555
(1 row)

SELECT count(1) FROM yezzey_dump_virtual_index('yezzey_otm_regaoty_1');
 count 
-------
     3
(1 row)

INSERT INTO yezzey_otm_regaoty_1 SELECT * FROM generate_series(1, 100000);
SELECT count(1) FROM yezzey_otm_regaoty_1;
 count  
--------
 200000
(1 row)

UPDATE yezzey_otm_regaoty_1 SET i = i + 1;
SELECT count(1) FROM yezzey_otm_regaoty_1;
 count  
--------
 200000
(1 row)

DELETE FROM yezzey_otm_regaoty_1 WHERE i < 50501;
SELECT count(1) FROM yezzey_otm_regaoty_1;
 count 
-------
 99002
(1 row)

SELECT * FROM yezzey_otm_regaoty_1 ORDER BY i LIMIT 5 OFFSET 7823;
   i   
-------
 54412
 54413
 54413
 54414
 54414
(5 rows)

SELECT segindex,external_bytes FROM yezzey_offload_relation_status('yezzey_otm_regaoty_1');
 segindex | external_bytes 
----------+----------------
        0 |         335168
        2 |         332656
        1 |         333816
(3 rows)

SELECT segindex,segfileindex,external_bytes FROM yezzey_offload_relation_status_per_filesegment('yezzey_otm_regaoty_1');
 segindex | segfileindex | external_bytes 
----------+--------------+----------------
        1 |            1 |         333816
        0 |            1 |         335168
        2 |            1 |         332656
(3 rows)

SELECT segindex,segfileindex,external_bytes FROM yezzey_relation_describe_external_storage_structure('yezzey_otm_regaoty_1');
 segindex | segfileindex | external_bytes 
----------+--------------+----------------
        2 |            1 |         332656
        1 |            1 |         333816
        0 |            1 |         335168
(3 rows)

SELECT count(), sum(external_bytes) FROM yezzey_offload_relation_status('yezzey_otm_regaoty_1');
 count |   sum   
-------+---------
     3 | 1001640
(1 row)

SELECT count(), sum(external_bytes) FROM yezzey_offload_relation_status_per_filesegment('yezzey_otm_regaoty_1');
 count |   sum   
-------+---------
     3 | 1001640
(1 row)

SELECT count(), sum(external_bytes) FROM yezzey_relation_describe_external_storage_structure('yezzey_otm_regaoty_1');
 count |   sum   
-------+---------
     3 | 1001640
(1 row)

DROP TABLE yezzey_otm_regaoty_1;
DROP TABLE yezzey_otm_regaoty_2;
DROP TABLESPACE tab1;
DROP TABLESPACE tab2;
DROP EXTENSION yezzey;
CHECKPOINT;
